-- 1 day interval --
create table t_day_1(c1 int, c2 timestamp without time zone, c3 int)
partition by range(c2) begin(timestamp without time zone '2015-09-01') step(interval '1 day') partitions(63)
distribute by shard(c1);
NOTICE:  Replica identity is needed for shard table, please add to this table through "alter table" command.
insert into t_day_1 values(1, timestamp without time zone '2015-08-31 13:11:00', 1);
ERROR:  value to inserted execeed range of partitioned table
select c1,c2,c3 from t_day_1 partition for(timestamp without time zone '2015-08-31 13:11:00');
ERROR:  the value for locating a partition is out of range.
insert into t_day_1 values(1, timestamp without time zone '2015-09-01 00:00:00', 1);
select c1,c2,c3 from t_day_1 partition for(timestamp without time zone '2015-09-01 01:00:00');
 c1 |            c2            | c3 
----+--------------------------+----
  1 | Tue Sep 01 00:00:00 2015 |  1
(1 row)

insert into t_day_1 values(1, timestamp without time zone '2015-09-03 00:00:00', 1);
select c1,c2,c3 from t_day_1 partition for(timestamp without time zone '2015-09-03 01:00:00');
 c1 |            c2            | c3 
----+--------------------------+----
  1 | Thu Sep 03 00:00:00 2015 |  1
(1 row)

insert into t_day_1 values(1, timestamp without time zone '2015-11-02 00:00:00', 1);
select c1,c2,c3 from t_day_1 partition for(timestamp without time zone '2015-11-02 01:00:00');
 c1 |            c2            | c3 
----+--------------------------+----
  1 | Mon Nov 02 00:00:00 2015 |  1
(1 row)

insert into t_day_1 values(1, timestamp without time zone '2015-11-03 00:00:00', 1);
ERROR:  value to inserted execeed range of partitioned table
select c1,c2,c3 from t_day_1 partition for(timestamp without time zone '2015-11-03 00:00:00');
ERROR:  the value for locating a partition is out of range.
delete from t_day_1;
select count(1) from t_day_1;
 count 
-------
     0
(1 row)

insert into t_day_1 values(1, timestamp without time zone '2015-09-01 13:11:00', 1);
insert into t_day_1 select generate_series(2,3), timestamp without time zone '2015-09-02 13:11:00', 1;
insert into t_day_1 select generate_series(4,7), timestamp without time zone '2015-09-03 13:11:00', 1;
insert into t_day_1 select generate_series(8,15), timestamp without time zone '2015-09-04 13:11:00', 1;
insert into t_day_1 select generate_series(16,31), timestamp without time zone '2015-09-05 13:11:00', 1;
insert into t_day_1 select generate_series(32,63), timestamp without time zone '2015-09-06 13:11:00', 1;
insert into t_day_1 select generate_series(64,127), timestamp without time zone '2015-09-07 13:11:00', 1;
insert into t_day_1 select generate_series(128,255), timestamp without time zone '2015-09-08 13:11:00', 1;
insert into t_day_1 select generate_series(256,511), timestamp without time zone '2015-09-09 13:11:00', 1;
insert into t_day_1 select generate_series(512,1023), timestamp without time zone '2015-09-10 13:11:00', 1;
insert into t_day_1 select generate_series(1024,2047), timestamp without time zone '2015-09-11 13:11:00', 1;
insert into t_day_1 select generate_series(2048,4095), timestamp without time zone '2015-09-12 13:11:00', 1;
insert into t_day_1 select generate_series(4096,8191), timestamp without time zone '2015-09-13 13:11:00', 1;
insert into t_day_1 select generate_series(8192,16383), timestamp without time zone '2015-09-14 13:11:00', 1;
--pruning--
select count(1) from t_day_1 where c2 < timestamp without time zone '2015-09-01 00:00:00';
 count 
-------
     0
(1 row)

select count(1) from t_day_1 where c2 <= timestamp without time zone '2015-09-01 00:00:00';
 count 
-------
     0
(1 row)

select count(1) from t_day_1 where c2 < timestamp without time zone '2015-09-01 23:00:00';
 count 
-------
     1
(1 row)

select count(1) from t_day_1 where c2 > timestamp without time zone '2015-09-01 01:00:00' and c2 < timestamp without time zone '2015-09-05 00:00:00';
 count 
-------
    15
(1 row)

select count(1) from t_day_1 where c2 > timestamp without time zone '2015-09-01 01:00:00' and c2 <= timestamp without time zone '2015-09-05 00:00:00';
 count 
-------
    15
(1 row)

select count(1) from t_day_1 where c2 > timestamp without time zone '2015-11-04 13:00:00';
 count 
-------
     0
(1 row)

select count(1) from t_day_1 where c2 > timestamp without time zone '2015-11-04 13:00:00' OR c2 < timestamp without time zone '2015-09-01 00:00:00';
 count 
-------
     0
(1 row)

select count(1) from t_day_1 where c2 < timestamp without time zone '2015-09-03 01:00:00' OR c2 > timestamp without time zone '2015-09-13 00:00:00';
 count 
-------
 12291
(1 row)

--update--
update t_day_1 set c3=2 where c2 < timestamp without time zone '2015-09-01 00:00:00';
update t_day_1 set c3=3 where c2 > timestamp without time zone '2015-11-04 13:00:00';
update t_day_1 set c3=4 where c2 < timestamp without time zone '2015-09-03 00:00:00';
select * from t_day_1 where c3=2;
 c1 | c2 | c3 
----+----+----
(0 rows)

select * from t_day_1 where c3=3;
 c1 | c2 | c3 
----+----+----
(0 rows)

select * from t_day_1 where c3=4 order by c1;
 c1 |            c2            | c3 
----+--------------------------+----
  1 | Tue Sep 01 13:11:00 2015 |  4
  2 | Wed Sep 02 13:11:00 2015 |  4
  3 | Wed Sep 02 13:11:00 2015 |  4
(3 rows)

--truncate --
truncate table t_day_1 partition for(timestamp without time zone '2015-08-30 00:00:00');
ERROR:  the value for locating a partition is out of range
truncate table t_day_1 partition for(timestamp without time zone '2015-09-02 00:00:00');
select count(1) from t_day_1 partition for(timestamp without time zone '2015-09-02 00:00:00');
 count 
-------
     0
(1 row)

select count(1) from t_day_1;
 count 
-------
 16381
(1 row)

truncate table t_day_1 partition for(timestamp without time zone '2015-11-04 00:00:00');
ERROR:  the value for locating a partition is out of range
drop table t_day_1;
-- 1 week interval--
create table t_day_7(c1 int, c2 timestamp without time zone, c3 int)
partition by range(c2) begin(timestamp without time zone '2015-09-01') step(interval '7 day') partitions(10)
distribute by shard(c1);
NOTICE:  Replica identity is needed for shard table, please add to this table through "alter table" command.
insert into t_day_7 values(1, timestamp without time zone '2015-08-31 13:11:00', 1);
ERROR:  value to inserted execeed range of partitioned table
select c1,c2,c3 from t_day_7 partition for(timestamp without time zone '2015-08-31 13:11:00');
ERROR:  the value for locating a partition is out of range.
insert into t_day_7 values(1, timestamp without time zone '2015-09-01 00:00:00', 1);
select c1,c2,c3 from t_day_7 partition for(timestamp without time zone '2015-09-01 01:00:00');
 c1 |            c2            | c3 
----+--------------------------+----
  1 | Tue Sep 01 00:00:00 2015 |  1
(1 row)

insert into t_day_7 values(1, timestamp without time zone '2015-09-08 00:00:00', 1);
select c1,c2,c3 from t_day_7 partition for(timestamp without time zone '2015-09-08 01:00:00');
 c1 |            c2            | c3 
----+--------------------------+----
  1 | Tue Sep 08 00:00:00 2015 |  1
(1 row)

insert into t_day_7 values(1, timestamp without time zone '2015-11-09 00:00:00', 1);
select c1,c2,c3 from t_day_7 partition for(timestamp without time zone '2015-11-09 01:00:00');
 c1 |            c2            | c3 
----+--------------------------+----
  1 | Mon Nov 09 00:00:00 2015 |  1
(1 row)

insert into t_day_7 values(1, timestamp without time zone '2015-11-10 00:00:00', 1);
ERROR:  value to inserted execeed range of partitioned table
select c1,c2,c3 from t_day_7 partition for(timestamp without time zone '2015-11-10 00:00:00');
ERROR:  the value for locating a partition is out of range.
delete from t_day_7;
select count(1) from t_day_7;
 count 
-------
     0
(1 row)

insert into t_day_7 values(1, timestamp without time zone '2015-09-01 13:11:00', 1);
insert into t_day_7 select generate_series(2,3), timestamp without time zone '2015-09-08 13:11:00', 1;
insert into t_day_7 select generate_series(4,7), timestamp without time zone '2015-09-15 13:11:00', 1;
insert into t_day_7 select generate_series(8,15), timestamp without time zone '2015-09-22 13:11:00', 1;
insert into t_day_7 select generate_series(16,31), timestamp without time zone '2015-09-29 13:11:00', 1;
insert into t_day_7 select generate_series(32,63), timestamp without time zone '2015-10-06 13:11:00', 1;
insert into t_day_7 select generate_series(64,127), timestamp without time zone '2015-10-13 13:11:00', 1;
insert into t_day_7 select generate_series(128,255), timestamp without time zone '2015-10-20 13:11:00', 1;
insert into t_day_7 select generate_series(256,511), timestamp without time zone '2015-10-27 13:11:00', 1;
insert into t_day_7 select generate_series(512,1023), timestamp without time zone '2015-11-03 13:11:00', 1;
--pruning--                
select count(1) from t_day_7 where c2 < timestamp without time zone '2015-09-01 00:00:00';
 count 
-------
     0
(1 row)

select count(1) from t_day_7 where c2 <= timestamp without time zone '2015-09-01 00:00:00';
 count 
-------
     0
(1 row)

select count(1) from t_day_7 where c2 < timestamp without time zone '2015-09-01 14:00:00';
 count 
-------
     1
(1 row)

select count(1) from t_day_7 where c2 > timestamp without time zone '2015-09-01 01:00:00' and c2 < timestamp without time zone '2015-09-16 00:00:00';
 count 
-------
     7
(1 row)

select count(1) from t_day_7 where c2 > timestamp without time zone '2015-09-01 01:00:00' and c2 <= timestamp without time zone '2015-09-16 00:00:00';
 count 
-------
     7
(1 row)

                           
select count(1) from t_day_7 where c2 > timestamp without time zone '2015-11-10 13:00:00';
 count 
-------
     0
(1 row)

                           
select count(1) from t_day_7 where c2 > timestamp without time zone '2015-11-10 13:00:00' OR c2 < timestamp without time zone '2015-09-01 00:00:00';
 count 
-------
     0
(1 row)

                           
select count(1) from t_day_7 where c2 < timestamp without time zone '2015-09-13 01:00:00' OR c2 > timestamp without time zone '2015-10-27 00:00:00';
 count 
-------
   771
(1 row)

--update--
update t_day_7 set c3=2 where c2 < timestamp without time zone '2015-09-01 00:00:00';
update t_day_7 set c3=3 where c2 > timestamp without time zone '2015-11-10 13:00:00';
update t_day_7 set c3=4 where c2 < timestamp without time zone '2015-09-09 00:00:00';
select * from t_day_7 where c3=2;
 c1 | c2 | c3 
----+----+----
(0 rows)

select * from t_day_7 where c3=3;
 c1 | c2 | c3 
----+----+----
(0 rows)

select * from t_day_7 where c3=4 order by c1;
 c1 |            c2            | c3 
----+--------------------------+----
  1 | Tue Sep 01 13:11:00 2015 |  4
  2 | Tue Sep 08 13:11:00 2015 |  4
  3 | Tue Sep 08 13:11:00 2015 |  4
(3 rows)

--truncate --
truncate table t_day_7 partition for(timestamp without time zone '2015-08-30 00:00:00');
ERROR:  the value for locating a partition is out of range
truncate table t_day_7 partition for(timestamp without time zone '2015-09-09 00:00:00');
select count(1) from t_day_7 partition for(timestamp without time zone '2015-09-09 00:00:00');
 count 
-------
     0
(1 row)

select count(1) from t_day_7;
 count 
-------
  1021
(1 row)

truncate table t_day_7 partition for(timestamp without time zone '2015-11-10 00:00:00');
ERROR:  the value for locating a partition is out of range
drop table t_day_7;
-- 1 month interval -- 
create table t_month_1(c1 int, c2 timestamp without time zone, c3 int)
partition by range(c2) begin(timestamp without time zone '2015-01-01') step(interval '1 month') partitions(24)
distribute by shard(c1);
NOTICE:  Replica identity is needed for shard table, please add to this table through "alter table" command.
insert into t_month_1 values(1, timestamp without time zone '2014-12-31 13:11:00', 1);
ERROR:  value to inserted execeed range of partitioned table
select c1,c2,c3 from t_month_1 partition for(timestamp without time zone '2014-12-31 13:11:00');
ERROR:  the value for locating a partition is out of range.
insert into t_month_1 values(1, timestamp without time zone '2015-01-01 00:00:00', 1);
select c1,c2,c3 from t_month_1 partition for(timestamp without time zone '2015-01-01 01:00:00');
 c1 |            c2            | c3 
----+--------------------------+----
  1 | Thu Jan 01 00:00:00 2015 |  1
(1 row)

insert into t_month_1 values(1, timestamp without time zone '2015-08-03 00:00:00', 1);
select c1,c2,c3 from t_month_1 partition for(timestamp without time zone '2015-08-03 01:00:00');
 c1 |            c2            | c3 
----+--------------------------+----
  1 | Mon Aug 03 00:00:00 2015 |  1
(1 row)

insert into t_month_1 values(1, timestamp without time zone '2016-11-03 00:00:00', 1);
select c1,c2,c3 from t_month_1 partition for(timestamp without time zone '2016-11-01 01:00:00');
 c1 |            c2            | c3 
----+--------------------------+----
  1 | Thu Nov 03 00:00:00 2016 |  1
(1 row)

insert into t_month_1 values(1, timestamp without time zone '2017-01-01 00:00:00', 1);
ERROR:  value to inserted execeed range of partitioned table
select c1,c2,c3 from t_month_1 partition for(timestamp without time zone '2017-01-01 00:00:00');
ERROR:  the value for locating a partition is out of range.
delete from t_month_1;
select count(1) from t_month_1;
 count 
-------
     0
(1 row)

insert into t_month_1 values(1, timestamp without time zone '2015-01-01 13:11:00', 1);
insert into t_month_1 select generate_series(2,3), timestamp without time zone '2015-02-01 13:11:00', 1;
insert into t_month_1 select generate_series(4,7), timestamp without time zone '2015-03-01 13:11:00', 1;
insert into t_month_1 select generate_series(8,15), timestamp without time zone '2015-04-01 13:11:00', 1;
insert into t_month_1 select generate_series(16,31), timestamp without time zone '2015-05-01 13:11:00', 1;
insert into t_month_1 select generate_series(32,63), timestamp without time zone '2015-06-01 13:11:00', 1;
insert into t_month_1 select generate_series(64,127), timestamp without time zone '2015-07-01 13:11:00', 1;
insert into t_month_1 select generate_series(128,255), timestamp without time zone '2015-08-01 13:11:00', 1;
insert into t_month_1 select generate_series(256,511), timestamp without time zone '2015-09-01 13:11:00', 1;
insert into t_month_1 select generate_series(512,1023), timestamp without time zone '2015-10-01 13:11:00', 1;
insert into t_month_1 select generate_series(1024,2047), timestamp without time zone '2015-11-01 13:11:00', 1;
insert into t_month_1 select generate_series(2048,4095), timestamp without time zone '2015-12-01 13:11:00', 1;
insert into t_month_1 select generate_series(4096,8191), timestamp without time zone '2016-01-01 13:11:00', 1;
insert into t_month_1 select generate_series(8192,16383), timestamp without time zone '2016-02-01 13:11:00', 1;
--pruning--           
select count(1) from t_month_1 where c2 < timestamp without time zone '2014-12-31 00:00:00';
 count 
-------
     0
(1 row)

select count(1) from t_month_1 where c2 <= timestamp without time zone '2015-01-02 00:00:00';
 count 
-------
     1
(1 row)

select count(1) from t_month_1 where c2 > timestamp without time zone '2015-04-01 13:00:00';
 count 
-------
 16376
(1 row)

select count(1) from t_month_1 where c2 > timestamp without time zone '2015-11-01 01:00:00' and c2 < timestamp without time zone '2016-1-05 00:00:00';
 count 
-------
  7168
(1 row)

select count(1) from t_month_1 where c2 > timestamp without time zone '2015-11-01 01:00:00' and c2 <= timestamp without time zone '2016-02-01 00:00:00';      
 count 
-------
  7168
(1 row)

select count(1) from t_month_1 where c2 > timestamp without time zone '2017-01-01 13:00:00';                   
 count 
-------
     0
(1 row)

select count(1) from t_month_1 where c2 > timestamp without time zone '2017-01-01 13:00:00' OR c2 < timestamp without time zone '2014-12-31 00:00:00';                     
 count 
-------
     0
(1 row)

select count(1) from t_month_1 where c2 < timestamp without time zone '2015-02-03 01:00:00' OR c2 > timestamp without time zone '2016-2-01 00:00:00';
 count 
-------
  8195
(1 row)

--update--
update t_month_1 set c3=2 where c2 < timestamp without time zone '2015-01-01 00:00:00';
update t_month_1 set c3=3 where c2 > timestamp without time zone '2017-01-01 13:00:00';
update t_month_1 set c3=4 where c2 < timestamp without time zone '2015-02-03 00:00:00';
select * from t_month_1 where c3=2;
 c1 | c2 | c3 
----+----+----
(0 rows)

select * from t_month_1 where c3=3;
 c1 | c2 | c3 
----+----+----
(0 rows)

select * from t_month_1 where c3=4 order by c1;
 c1 |            c2            | c3 
----+--------------------------+----
  1 | Thu Jan 01 13:11:00 2015 |  4
  2 | Sun Feb 01 13:11:00 2015 |  4
  3 | Sun Feb 01 13:11:00 2015 |  4
(3 rows)

--truncate --
truncate table t_month_1 partition for(timestamp without time zone '2014-12-31 00:00:00');
ERROR:  the value for locating a partition is out of range
truncate table t_month_1 partition for(timestamp without time zone '2015-09-02 00:00:00');
select count(1) from t_month_1 partition for(timestamp without time zone '2015-09-02 00:00:00');
 count 
-------
     0
(1 row)

select count(1) from t_month_1;
 count 
-------
 16127
(1 row)

truncate table t_month_1 partition for(timestamp without time zone '2017-01-04 00:00:00');
ERROR:  the value for locating a partition is out of range
drop table t_month_1;
-- 3 month interval --
create table t_month_3(c1 int, c2 timestamp without time zone, c3 int)
partition by range(c2) begin(timestamp without time zone '2015-01-01') step(interval '3 month') partitions(8)
distribute by shard(c1);
NOTICE:  Replica identity is needed for shard table, please add to this table through "alter table" command.
insert into t_month_3 values(1, timestamp without time zone '2014-12-31 13:11:00', 1);
ERROR:  value to inserted execeed range of partitioned table
select c1,c2,c3 from t_month_3 partition for(timestamp without time zone '2014-12-31 13:11:00');
ERROR:  the value for locating a partition is out of range.
insert into t_month_3 values(1, timestamp without time zone '2015-01-01 00:00:00', 1);
select c1,c2,c3 from t_month_3 partition for(timestamp without time zone '2015-01-01 01:00:00');
 c1 |            c2            | c3 
----+--------------------------+----
  1 | Thu Jan 01 00:00:00 2015 |  1
(1 row)

insert into t_month_3 values(1, timestamp without time zone '2015-08-03 00:00:00', 1);
select c1,c2,c3 from t_month_3 partition for(timestamp without time zone '2015-08-03 01:00:00');
 c1 |            c2            | c3 
----+--------------------------+----
  1 | Mon Aug 03 00:00:00 2015 |  1
(1 row)

insert into t_month_3 values(1, timestamp without time zone '2016-11-03 00:00:00', 1);
select c1,c2,c3 from t_month_3 partition for(timestamp without time zone '2016-11-01 01:00:00');
 c1 |            c2            | c3 
----+--------------------------+----
  1 | Thu Nov 03 00:00:00 2016 |  1
(1 row)

insert into t_month_3 values(1, timestamp without time zone '2017-01-01 00:00:00', 1);
ERROR:  value to inserted execeed range of partitioned table
select c1,c2,c3 from t_month_3 partition for(timestamp without time zone '2017-01-01 00:00:00');
ERROR:  the value for locating a partition is out of range.
delete from t_month_3;
select count(1) from t_month_3;
 count 
-------
     0
(1 row)

insert into t_month_3 values(1, timestamp without time zone '2015-01-01 13:11:00', 1);
insert into t_month_3 select generate_series(2,3), timestamp without time zone '2015-04-01 13:11:00', 1;
insert into t_month_3 select generate_series(4,7), timestamp without time zone '2015-07-01 13:11:00', 1;
insert into t_month_3 select generate_series(8,15), timestamp without time zone '2015-10-01 13:11:00', 1;
insert into t_month_3 select generate_series(16,31), timestamp without time zone '2016-01-01 13:11:00', 1;
insert into t_month_3 select generate_series(32,63), timestamp without time zone '2016-04-01 13:11:00', 1;
insert into t_month_3 select generate_series(64,127), timestamp without time zone '2016-07-01 13:11:00', 1;
insert into t_month_3 select generate_series(128,255), timestamp without time zone '2016-10-01 13:11:00', 1;
select count(1) from t_month_3 partition for(timestamp without time zone '2014-12-31 13:11:00');
ERROR:  the value for locating a partition is out of range.
select count(1) from t_month_3 partition for(timestamp without time zone '2015-09-05 13:11:00');
 count 
-------
     4
(1 row)

select count(1) from t_month_3 partition for(timestamp without time zone '2017-01-04 13:11:00');
ERROR:  the value for locating a partition is out of range.
--pruning--                  3
select count(1) from t_month_3 where c2 < timestamp without time zone '2014-12-31 00:00:00';
 count 
-------
     0
(1 row)

select count(1) from t_month_3 where c2 <= timestamp without time zone '2015-01-02 00:00:00';
 count 
-------
     1
(1 row)

select count(1) from t_month_3 where c2 > timestamp without time zone '2015-04-01 13:00:00';
 count 
-------
   254
(1 row)

select count(1) from t_month_3 where c2 > timestamp without time zone '2015-11-01 01:00:00' and c2 < timestamp without time zone '2016-2-05 00:00:00';
 count 
-------
    16
(1 row)

select count(1) from t_month_3 where c2 > timestamp without time zone '2015-11-01 01:00:00' and c2 <= timestamp without time zone '2016-02-01 00:00:00';      
 count 
-------
    16
(1 row)

select count(1) from t_month_3 where c2 > timestamp without time zone '2017-01-01 13:00:00';                   
 count 
-------
     0
(1 row)

select count(1) from t_month_3 where c2 > timestamp without time zone '2017-01-01 13:00:00' OR c2 < timestamp without time zone '2014-12-31 00:00:00';                     
 count 
-------
     0
(1 row)

select count(1) from t_month_3 where c2 < timestamp without time zone '2015-02-03 01:00:00' OR c2 > timestamp without time zone '2016-2-01 00:00:00';
 count 
-------
   225
(1 row)

--update--
update t_month_1 set c3=2 where c2 < timestamp without time zone '2015-01-01 00:00:00';
ERROR:  relation "t_month_1" does not exist
LINE 1: update t_month_1 set c3=2 where c2 < timestamp without time ...
               ^
update t_month_1 set c3=3 where c2 > timestamp without time zone '2017-01-01 13:00:00';
ERROR:  relation "t_month_1" does not exist
LINE 1: update t_month_1 set c3=3 where c2 > timestamp without time ...
               ^
update t_month_1 set c3=4 where c2 < timestamp without time zone '2015-02-03 00:00:00';
ERROR:  relation "t_month_1" does not exist
LINE 1: update t_month_1 set c3=4 where c2 < timestamp without time ...
               ^
select * from t_month_3 where c3=2;
 c1 | c2 | c3 
----+----+----
(0 rows)

select * from t_month_3 where c3=3;
 c1 | c2 | c3 
----+----+----
(0 rows)

select * from t_month_3 where c3=4 order by c1;
 c1 | c2 | c3 
----+----+----
(0 rows)

--truncate --
truncate table t_month_3 partition for(timestamp without time zone '2014-12-31 00:00:00');
ERROR:  the value for locating a partition is out of range
truncate table t_month_3 partition for(timestamp without time zone '2015-09-02 00:00:00');
select count(1) from t_month_3 partition for(timestamp without time zone '2015-09-02 00:00:00');
 count 
-------
     0
(1 row)

select count(1) from t_month_3;
 count 
-------
   251
(1 row)

truncate table t_month_3 partition for(timestamp without time zone '2017-01-01 00:00:00');
ERROR:  the value for locating a partition is out of range
drop table t_month_3;
-- 1 year interval --
create table t_year_1(c1 int, c2 timestamp without time zone, c3 int)
partition by range(c2) begin(timestamp without time zone '2015-01-01') step(interval '1 year') partitions(5)
distribute by shard(c1);
NOTICE:  Replica identity is needed for shard table, please add to this table through "alter table" command.
insert into t_year_1 values(1, timestamp without time zone '2014-12-31 13:11:00', 1);
ERROR:  value to inserted execeed range of partitioned table
explain verbose select c1,c2,c3 from t_year_1 partition for(timestamp without time zone '2014-12-31 13:11:00');
ERROR:  the value for locating a partition is out of range.
select c1,c2,c3 from t_year_1 partition for(timestamp without time zone '2014-12-31 13:11:00');
ERROR:  the value for locating a partition is out of range.
insert into t_year_1 values(1, timestamp without time zone '2015-01-01 00:00:00', 1);
explain verbose select c1,c2,c3 from t_year_1 partition for(timestamp without time zone '2015-01-01 01:00:00');
                                   QUERY PLAN                                    
---------------------------------------------------------------------------------
 Remote Fast Query Execution  (cost=0.00..0.00 rows=0 width=0)
   Output: t_year_1_part_0.c1, t_year_1_part_0.c2, t_year_1_part_0.c3
   Node/s: datanode_1, datanode_2
   Remote query: SELECT c1, c2, c3 FROM t_year_1_part_0
   ->  Seq Scan on public.t_year_1_part_0  (cost=0.00..21.90 rows=1190 width=16)
         Output: c1, c2, c3
(6 rows)

select c1,c2,c3 from t_year_1 partition for(timestamp without time zone '2015-01-01 01:00:00');
 c1 |            c2            | c3 
----+--------------------------+----
  1 | Thu Jan 01 00:00:00 2015 |  1
(1 row)

insert into t_year_1 values(1, timestamp without time zone '2016-08-03 00:00:00', 1);
explain verbose select c1,c2,c3 from t_year_1 partition for(timestamp without time zone '2016-08-03 01:00:00');
                                   QUERY PLAN                                    
---------------------------------------------------------------------------------
 Remote Fast Query Execution  (cost=0.00..0.00 rows=0 width=0)
   Output: t_year_1_part_1.c1, t_year_1_part_1.c2, t_year_1_part_1.c3
   Node/s: datanode_1, datanode_2
   Remote query: SELECT c1, c2, c3 FROM t_year_1_part_1
   ->  Seq Scan on public.t_year_1_part_1  (cost=0.00..21.90 rows=1190 width=16)
         Output: c1, c2, c3
(6 rows)

select c1,c2,c3 from t_year_1 partition for(timestamp without time zone '2015-06-03 01:00:00');
 c1 |            c2            | c3 
----+--------------------------+----
  1 | Thu Jan 01 00:00:00 2015 |  1
(1 row)

insert into t_year_1 values(1, timestamp without time zone '2019-11-03 00:00:00', 1);
explain verbose select c1,c2,c3 from t_year_1 partition for(timestamp without time zone '2019-11-01 01:00:00');
                                   QUERY PLAN                                    
---------------------------------------------------------------------------------
 Remote Fast Query Execution  (cost=0.00..0.00 rows=0 width=0)
   Output: t_year_1_part_4.c1, t_year_1_part_4.c2, t_year_1_part_4.c3
   Node/s: datanode_1, datanode_2
   Remote query: SELECT c1, c2, c3 FROM t_year_1_part_4
   ->  Seq Scan on public.t_year_1_part_4  (cost=0.00..21.90 rows=1190 width=16)
         Output: c1, c2, c3
(6 rows)

select c1,c2,c3 from t_year_1 partition for(timestamp without time zone '2019-11-01 01:00:00');
 c1 |            c2            | c3 
----+--------------------------+----
  1 | Sun Nov 03 00:00:00 2019 |  1
(1 row)

insert into t_year_1 values(1, timestamp without time zone '2020-01-01 00:00:00', 1);
ERROR:  value to inserted execeed range of partitioned table
explain verbose select c1,c2,c3 from t_year_1 partition for(timestamp without time zone '2020-01-01 00:00:00');
ERROR:  the value for locating a partition is out of range.
select c1,c2,c3 from t_year_1 partition for(timestamp without time zone '2020-01-01 00:00:00');
ERROR:  the value for locating a partition is out of range.
delete from t_year_1;
select count(1) from t_year_1;
 count 
-------
     0
(1 row)

insert into t_year_1 values(1, timestamp without time zone '2015-01-01 13:11:00', 1);
insert into t_year_1 values(generate_series(2,3), timestamp without time zone '2016-01-01 13:11:00', 1);
insert into t_year_1 values(generate_series(4,7), timestamp without time zone '2017-01-01 13:11:00', 1);
insert into t_year_1 values(generate_series(8,15), timestamp without time zone '2018-01-01 13:11:00', 1);
insert into t_year_1 values(generate_series(16,31), timestamp without time zone '2019-01-01 13:11:00', 1);
select count(1) from t_year_1 partition for(timestamp without time zone '2014-12-31 13:11:00');
ERROR:  the value for locating a partition is out of range.
select count(1) from t_year_1 partition for(timestamp without time zone '2017-09-05 13:11:00');
 count 
-------
     4
(1 row)

select count(1) from t_year_1 partition for(timestamp without time zone '2020-01-04 13:11:00');
ERROR:  the value for locating a partition is out of range.
--pruning--            
select count(1) from t_year_1 where c2 < timestamp without time zone '2014-12-31 00:00:00';
 count 
-------
     0
(1 row)

select count(1) from t_year_1 where c2 <= timestamp without time zone '2015-01-02 00:00:00';
 count 
-------
     1
(1 row)

select count(1) from t_year_1 where c2 > timestamp without time zone '2018-04-01 13:00:00';
 count 
-------
    16
(1 row)

select count(1) from t_year_1 where c2 > timestamp without time zone '2017-11-01 01:00:00' and c2 < timestamp without time zone '2019-2-05 00:00:00';
 count 
-------
    24
(1 row)

select count(1) from t_year_1 where c2 > timestamp without time zone '2019-01-01 01:00:00' and c2 <= timestamp without time zone '2015-02-01 00:00:00';      
 count 
-------
     0
(1 row)

select count(1) from t_year_1 where c2 > timestamp without time zone '2020-01-01 13:00:00';                   
 count 
-------
     0
(1 row)

select count(1) from t_year_1 where c2 > timestamp without time zone '2020-01-01 13:00:00' OR c2 < timestamp without time zone '2014-12-31 00:00:00';                     
 count 
-------
     0
(1 row)

select count(1) from t_year_1 where c2 < timestamp without time zone '2015-02-03 01:00:00' OR c2 > timestamp without time zone '2019-01-01 00:00:00';
 count 
-------
    17
(1 row)

--update--
update t_year_1 set c3=2 where c2 < timestamp without time zone '2015-01-01 00:00:00';
update t_year_1 set c3=3 where c2 > timestamp without time zone '2020-01-01 13:00:00';
update t_year_1 set c3=4 where c2 < timestamp without time zone '2016-02-03 00:00:00';
select * from t_year_1 where c3=2;
 c1 | c2 | c3 
----+----+----
(0 rows)

select * from t_year_1 where c3=3;
 c1 | c2 | c3 
----+----+----
(0 rows)

select * from t_year_1 where c3=4 order by c1;
 c1 |            c2            | c3 
----+--------------------------+----
  1 | Thu Jan 01 13:11:00 2015 |  4
  2 | Fri Jan 01 13:11:00 2016 |  4
  3 | Fri Jan 01 13:11:00 2016 |  4
(3 rows)

--truncate --
truncate table t_year_1 partition for(timestamp without time zone '2014-12-31 00:00:00');
ERROR:  the value for locating a partition is out of range
truncate table t_year_1 partition for(timestamp without time zone '2016-09-02 00:00:00');
select count(1) from t_year_1 partition for(timestamp without time zone '2016-09-02 00:00:00');
 count 
-------
     0
(1 row)

select count(1) from t_year_1;
 count 
-------
    29
(1 row)

truncate table t_year_1 partition for(timestamp without time zone '2020-01-01 00:00:00');
ERROR:  the value for locating a partition is out of range
drop table t_year_1;
